{
  "schemaVersion": "1.0.0",
  "environment": "replacement-validation",
  "production": true,
  "tenantId": "11111111-1111-4111-8111-111111111111",
  "apiClientId": "22222222-2222-4222-8222-222222222222",
  "spaClientId": "33333333-3333-4333-8333-333333333333",
  "audience": "api://22222222-2222-4222-8222-222222222222",
  "issuer": "https://login.microsoftonline.com/11111111-1111-4111-8111-111111111111/v2.0",
  "jwksUri": "https://login.microsoftonline.com/11111111-1111-4111-8111-111111111111/discovery/v2.0/keys",
  "frontDoorOrigin": "https://sentinel-replacement.example.com",
  "redirectUri": "https://sentinel-replacement.example.com/auth-redirect.html",
  "postLogoutRedirectUri": "https://sentinel-replacement.example.com/",
  "scopes": {
    "read": ["AgentSentinel.Read"],
    "write": ["AgentSentinel.Write"],
    "spa": ["api://22222222-2222-4222-8222-222222222222/AgentSentinel.Read"]
  },
  "roles": [
    "AgentSentinel.Viewer",
    "AgentSentinel.Analyst",
    "AgentSentinel.Approver",
    "AgentSentinel.Administrator"
  ],
  "estateGrants": [
    {
      "id": "default",
      "name": "Replacement validation estate",
      "tenantId": "44444444-4444-4444-8444-444444444444",
      "environment": "replacement-validation",
      "isDefault": true,
      "allowedAuthTenantIds": ["11111111-1111-4111-8111-111111111111"]
    }
  ],
  "writesEnabled": false,
  "waf": {
    "policyMode": "Prevention",
    "mutationGuardContractDigest": "sha256:f8aa6df2920fc6ba05a5695a4372c7b72b46054ac40b9aa14cd9a469d41ac19d",
    "mutationGuardDeployment": "separate-after-jwt-read-validation",
    "mutationGuardEnabledDuringAuthActivation": false,
    "unchanged": true
  },
  "deployment": {
    "commitSha": "aaaaaaaaaaaaaaaaaaaaaaaaaaaaaaaaaaaaaaaa",
    "apiImageDigest": "sha256:bbbbbbbbbbbbbbbbbbbbbbbbbbbbbbbbbbbbbbbbbbbbbbbbbbbbbbbbbbbbbbbb",
    "webImageDigest": "sha256:cccccccccccccccccccccccccccccccccccccccccccccccccccccccccccccccc"
  }
}
